{
  "contract_version": "public-capability-entitlements.v1",
  "policy_revision": "2026-08-27",
  "generated_at": "2026-08-27T12:00:00Z",
  "actor": {
    "actor_id": "actor_synthetic_01",
    "practice_id": "practice_synthetic_01",
    "role": "owner",
    "membership_state": "active"
  },
  "gates": {
    "email_verified": true,
    "baa_accepted": true,
    "terms_accepted": true,
    "privacy_accepted": true,
    "subscription_state": "trialing",
    "credential_required": true,
    "credential_state": "pending"
  },
  "seats": {
    "active_clinician_seats": 1,
    "maximum_active_clinician_seats": 20,
    "pending_invitations": 0,
    "stripe_quantity_sync_required": false
  },
  "capabilities": {
    "soap_note": {
      "decision": "denied",
      "data_mode": "synthetic_only",
      "rollout": "enabled",
      "operation_mode": "standard",
      "reason_codes": ["credential_pending"]
    },
    "intake_prep": {
      "decision": "denied",
      "data_mode": "none",
      "rollout": "disabled",
      "operation_mode": "standard",
      "reason_codes": ["credential_pending", "rollout_disabled"]
    },
    "session_prep": {
      "decision": "denied",
      "data_mode": "none",
      "rollout": "disabled",
      "operation_mode": "read_only",
      "reason_codes": ["credential_pending", "rollout_disabled"]
    },
    "scribe": {
      "decision": "denied",
      "data_mode": "none",
      "rollout": "disabled",
      "operation_mode": "web_pwa_first",
      "reason_codes": ["credential_pending", "rollout_disabled"]
    },
    "cab": {
      "decision": "denied",
      "data_mode": "none",
      "rollout": "disabled",
      "operation_mode": "advisory_only",
      "reason_codes": ["credential_pending", "rollout_disabled"]
    }
  }
}
